{
  "version": 1,
  "recipeType": "forestry:centrifuge",
  "block": "forestry:centrifuge",
  "inputs":  { "items": { "capability": "ItemHandler", "slots": [0] } },
  "outputs": { "items": { "capability": "ItemHandler", "slots": [1,2,3,4,5,6,7,8,9] } },
  "validation": { "mode": "distribution", "samples": 1000, "distributionTolerance": 0.05 },
  "tickBudget": "auto"
}
