{
  "version": 1,
  "recipeType": "forestry:squeezer",
  "block": "forestry:squeezer",
  "inputs":  { "items":  { "capability": "ItemHandler",  "slots": [0,1,2,3,4,5,6,7,8] } },
  "outputs": {
    "items":  { "capability": "ItemHandler",  "slots": [9] },
    "fluids": { "capability": "FluidHandler", "tank": 0 }
  },
  "tickBudget": "auto"
}
